{
  "$schema": "https://json-schema.org/draft/2020-12/schema",
  "$id": "https://forge.local/spec/payload-schema.json",
  "title": "Forge License Payload (v1.0)",
  "description": "The canonical JSON inside .forge/payload.json. The exact serialised bytes are what is signed.",
  "type": "object",
  "additionalProperties": false,
  "required": [
    "protocol_version",
    "license_id",
    "customer_id",
    "product_id",
    "mode",
    "scope",
    "binding",
    "bound_fingerprint",
    "issued_at",
    "expires_at",
    "features",
    "limits"
  ],
  "properties": {
    "protocol_version": {
      "type": "string",
      "enum": ["1.0"],
      "description": "Payload schema version. Bump on wire-breaking change."
    },
    "license_id": {
      "type": "string",
      "minLength": 1,
      "maxLength": 64,
      "description": "Globally unique license identifier (snowflake-like, generated by LA)."
    },
    "customer_id": {
      "type": "string",
      "minLength": 1,
      "maxLength": 128
    },
    "product_id": {
      "type": "string",
      "minLength": 1,
      "maxLength": 128
    },
    "mode": {
      "type": "string",
      "enum": ["offline", "hybrid", "online"]
    },
    "scope": {
      "type": "string",
      "enum": ["instance", "customer", "customer_x_product"],
      "description": "Granularity at which this license is enforced."
    },
    "binding": {
      "type": "string",
      "enum": ["none", "soft", "hard"]
    },
    "bound_fingerprint": {
      "type": ["string", "null"],
      "description": "Required when binding != none. SHA-256 hex of the canonical fingerprint string."
    },
    "issued_at": {
      "type": "string",
      "format": "date-time"
    },
    "expires_at": {
      "type": "string",
      "format": "date-time"
    },
    "features": {
      "type": "object",
      "description": "Boolean / scalar feature toggles; semantics defined per product."
    },
    "limits": {
      "type": "object",
      "description": "Numeric / scalar quota values; semantics defined per product."
    }
  }
}
